description,image_id
"Magnetar's laboratory in the cosmic realm, where extreme magnetic fields create exotic states of matter, pushing the boundaries of our understanding of cosmic physics.",241.png
"Galactic footprints in cosmic sands, as galaxies drift through space, leaving cosmic trails that tell the story of their cosmic journey.",242.png
"Dream of the cosmic archaeologist, an asteroid belt harboring remnants of ancient celestial bodies, offering glimpses into the cosmic history etched in their rocky surfaces.",243.png
"Cosmic masquerade, where planets don disguises of gas giants, rocky worlds, and icy orbs, playing cosmic hide-and-seek in the vastness of their solar systems.",244.png
"Stellar symphony, the harmonious interplay of different types of stars, each contributing its unique notes to the cosmic orchestra of the night sky.",245.png
"Cosmic beehive, a densely populated star cluster where stars buzz around, creating a hive of celestial activity in the vastness of space.",246.png
"Cosmic tide, gravitational forces sculpting tidal tails as galaxies interact, leaving behind cosmic fingerprints of their celestial encounters.",247.png
"Cosmic prism, where light from distant galaxies passes through cosmic lenses, revealing the intricate spectrum of their cosmic compositions.",248.png
"Cosmic loom, where dark matter threads weave through the cosmic fabric, shaping the large-scale structures of the universe.",249.png
"Diorama of planetary transits in the cosmic theater, as distant worlds cross in front of their host stars, casting tiny shadows observed by astronomers.",250.png
"Cascade of cosmic rays, high-energy particles racing through space, leaving trails of ionization as they journey through the interstellar medium.",251.png
"Celestial gladiator arena, where cosmic forces collide in titanic battles, shaping the cosmic landscape in the aftermath of their celestial clashes.",252.png
"Cosmic voyage, interstellar ships navigating the vastness of space, charting courses through the cosmic currents and stellar winds.",253.png
"Quantum harmonics, cosmic strings vibrating in the cosmic orchestra, resonating with the fundamental frequencies of the universe.",254.png
"Cosmic metamorphosis, celestial bodies undergoing transformative processes, evolving and reshaping in the cosmic crucible of time.",255.png
"Astral melodies, ethereal cosmic tunes echoing through the cosmic void, composing symphonies that transcend the boundaries of space and time.",256.png
"Cosmic novelties, rare celestial phenomena captivating the cosmic audience with their enigmatic displays, leaving cosmic wonders in their wake.",257.png
"Cosmic gatherings, star clusters huddling together in the vast cosmic expanse, sharing their stellar radiance.",258.png
"Galactic tapestry, a myriad of stars in a galaxy weaving intricate patterns of light and shadow across cosmic canvases.",259.png
"Exoplanetary odyssey, alien worlds dancing in the cosmic ballet around distant suns, each telling a unique cosmic tale.",260.png
"Stellar camaraderie, a cluster of stars bound by gravitational forces, creating celestial communities in the cosmic neighborhood.",261.png
"Galactic choreography, stars in a spiral galaxy moving in harmony, orchestrating cosmic dances that span cosmic epochs.",262.png
"Exoplanetary wonders, alien landscapes on distant worlds unveiling cosmic wonders beyond earthly imagination.",263.png
"Cosmic convocation, a congregation of stars in open clusters, gathering together in the celestial amphitheater of space.",264.png
"Galactic legends, massive galaxies telling stories of cosmic collisions and mergers, shaping their cosmic destinies.",265.png
"Exoplanetary symphony, distant planets harmonizing with their host stars, contributing celestial notes to the cosmic orchestra.",266.png
"Cosmic constellation, a collection of stars forming patterns that echo through the cosmic expanse, connecting the celestial dots.",267.png
"Stellar fellowship, stars in a globular cluster sharing the cosmic journey, bound by the gravitational embrace of their cosmic kinship.",268.png
"Galactic luminosity, a galaxy ablaze with stellar brilliance, painting the cosmic canvas with radiant hues of celestial light.",269.png
"Exoplanetary marvels, distant planets showcasing cosmic marvels like towering mountains and vast oceans, observed from afar.",270.png
"Cosmic rendezvous, stars in a cluster converging in the cosmic rendezvous, creating breathtaking celestial spectacles.",271.png
"Galactic grandeur, a majestic spiral galaxy displaying its cosmic grandeur, with arms swirling in the celestial dance of creation.",272.png
"Exoplanetary frontiers, alien worlds pushing the cosmic boundaries, inviting exploration into the uncharted realms of the cosmos.",273.png
"Cosmic jubilation, a cluster of stars celebrating cosmic events with bursts of radiant energy, lighting up the cosmic festivities.",274.png
"Galactic pathways, stars in a barred spiral galaxy tracing cosmic pathways through the vast interstellar expanse.",275.png
"Exoplanetary odysseys, distant planets embarking on cosmic odysseys, exploring the vastness of their planetary realms.",276.png
"Stellar enigma, a mysterious globular cluster shrouded in cosmic secrecy, revealing its celestial puzzles to those who gaze upon it.",277.png
"Galactic ballet, stars in an irregular galaxy performing a mesmerizing ballet, dancing to the cosmic rhythms of the universe.",278.png
"Exoplanetary kaleidoscope, alien worlds exhibiting a vibrant cosmic kaleidoscope of colors, captivating cosmic observers.",279.png
"Cosmic unity, stars in an open cluster harmonizing their cosmic energies, creating a celestial symphony in the cosmic concert hall.",280.png
"Galactic reflections, a spiral galaxy reflecting its cosmic brilliance on the tranquil cosmic waters of interstellar space.",281.png
"Exoplanetary realms, distant planets revealing the diverse landscapes of their cosmic realms, from deserts to oceans.",282.png
"Cosmic cascade, stars in a cluster cascading through the cosmic terrain, leaving trails of cosmic stardust in their wake.",283.png
"Galactic ethereality, a barred spiral galaxy exuding an ethereal cosmic aura, transcending the cosmic boundaries of ordinary celestial beauty.",284.png
"Exoplanetary tapestry, distant worlds weaving a cosmic tapestry of landscapes, creating a celestial masterpiece in the cosmic gallery.",285.png
"Cosmic congregation, stars in a globular cluster congregating in the cosmic sanctuary, bound by the gravitational embrace of their celestial community.",286.png
"Galactic wonders, a galaxy adorned with cosmic wonders, from massive nebulae to intricate cosmic dust lanes.",287.png
"Exoplanetary ballet, distant planets engaging in a cosmic ballet around their host stars, gracefully moving through the celestial dance floor.",288.png
"Cosmic allure, a star cluster emitting an irresistible cosmic allure, drawing the gaze of cosmic observers into its radiant heart.",289.png
"Galactic symphony, stars in a spiral galaxy contributing their celestial notes to the harmonious cosmic symphony of the cosmos.",290.png
"Exoplanetary enigmas, distant planets shrouded in cosmic enigmas, inviting astronomers to unravel the mysteries of their celestial realms.",291.png
"Cosmic intricacies, stars in a cluster revealing the intricate cosmic patterns woven into the fabric of the celestial tapestry.",292.png
"Galactic voyage, a barred spiral galaxy embarking on a cosmic voyage through the interstellar sea of cosmic wonders.",293.png
"Exoplanetary odyssey, distant worlds undertaking epic cosmic odysseys, exploring the uncharted realms of their planetary domains.",294.png
"Cosmic jubilation, a star cluster celebrating cosmic events with bursts of radiant energy, illuminating the cosmic festivities with stellar brilliance.",295.png
"Galactic pathways, stars in a barred spiral galaxy tracing cosmic pathways through the vast cosmic expanse of interstellar space.",296.png
"Exoplanetary marvels, distant planets showcasing cosmic marvels like towering mountains and vast oceans, observed from the cosmic vantage point.",297.png
"Cosmic rendezvous, stars in a cluster converging in the cosmic rendezvous, creating breathtaking celestial spectacles in the cosmic amphitheater.",298.png
"Galactic grandeur, a majestic spiral galaxy displaying its cosmic grandeur, with arms swirling in the celestial dance of cosmic creation.",299.png
"Exoplanetary frontiers, alien worlds pushing the cosmic boundaries, inviting exploration into the uncharted realms of the cosmic frontier.",300.png
"Black hole majesty, a cosmic behemoth with immense gravitational pull, warping the fabric of space-time in its celestial dominion.",301.png
"White hole brilliance, a cosmic fountain of light and energy, expelling celestial matter into the cosmic expanse with unmatched luminosity.",302.png
"Wormhole gateway, a cosmic tunnel bending space-time, connecting distant cosmic realms through the enigmatic corridors of the wormhole.",303.png
"Parallel universe echoes, celestial reflections in alternate cosmic dimensions, where realities diverge and cosmic possibilities unfold.",304.png
"Black hole singularity, a point of infinite density at the heart of a black hole, where cosmic laws break down in the cosmic abyss.",305.png
"White hole enigma, a cosmic mystery expelling celestial wonders, challenging our understanding of the cosmic order.",306.png
"Wormhole traverse, a cosmic journey through the tunnels of space-time, offering shortcuts through the vast cosmic distances.",307.png
"Parallel universe convergence, cosmic realms colliding and merging in the cosmic ballet of parallel universes, creating celestial tapestries.",308.png
"Black hole voracity, a celestial vacuum devouring everything in its cosmic vicinity, leaving behind only the echoes of cosmic consumption.",309.png
"White hole radiance, a cosmic beacon emitting brilliant rays of celestial light, illuminating the cosmic darkness with ethereal luminosity.",310.png
"Wormhole nexus, a cosmic crossroads where multiple space-time paths converge, opening gateways to diverse cosmic destinations.",311.png
"Parallel universe veils, cosmic curtains separating realities, revealing glimpses of alternate cosmic realms beyond the cosmic divide.",312.png
"Black hole dance, stars swirling in a cosmic waltz around a black hole, entranced by the gravitational pull of the cosmic maestro.",313.png
"White hole brilliance, a cosmic explosion of energy and light, a celestial spectacle challenging the cosmic norms.",314.png
"Wormhole mysteries, cosmic portals defying conventional space-time, harboring enigmatic cosmic secrets within their interstellar corridors.",315.png
"Parallel universe intersections, cosmic crossroads where alternate realities intersect, creating cosmic landscapes of intertwined destinies.",316.png
"Black hole horizon, the cosmic boundary where light succumbs to the gravitational forces of a black hole, disappearing into the cosmic abyss.",317.png
"White hole phenomena, a cosmic burst of celestial phenomena emanating from a white hole, casting cosmic wonders into the vast expanse.",318.png
"Wormhole explorers, celestial voyagers navigating the cosmic highways of wormholes, seeking cosmic frontiers beyond the known realms.",319.png
"Parallel universe echoes, cosmic reflections resonating through the fabric of space-time, whispering tales of alternate cosmic realities.",320.png
"Black hole celestial ballet, stars pirouetting in the cosmic dance around a black hole, captivated by its gravitational allure.",321.png
"White hole luminosity, a celestial beacon radiating intense cosmic luminosity, illuminating the cosmic darkness with ethereal brilliance.",322.png
"Wormhole passages, cosmic channels traversing the vastness of space-time, offering shortcuts to distant cosmic realms.",323.png
"Parallel universe tapestry, a celestial quilt woven with threads of alternate realities, creating a cosmic mosaic of diverse cosmic possibilities.",324.png
"Black hole abyss, a cosmic chasm where the laws of physics unravel, plunging all matter into the cosmic depths of the singularity.",325.png
"White hole spectacle, a cosmic display of celestial fireworks erupting from a white hole, challenging the cosmic norms of energy expulsion.",326.png
"Wormhole traverse, a cosmic journey through the tunnels of space-time, bending the cosmic fabric to connect distant corners of the universe.",327.png
"Parallel universe convergence, cosmic realms colliding and merging in the celestial symphony of parallel universes, creating cosmic harmonies.",328.png
"Black hole enigma, a celestial puzzle challenging the cosmic conundrums of space-time, where the cosmic mysteries unfold.",329.png
"White hole radiance, a cosmic explosion of celestial brilliance, a dazzling display challenging our understanding of the cosmic order.",330.png
"Wormhole nexus, a cosmic crossroads where space-time paths converge, opening gateways to diverse cosmic destinations.",331.png
"Parallel universe veils, cosmic curtains separating alternate realities, revealing glimpses of cosmic realms beyond the cosmic divide.",332.png
"Black hole dance, stars swirling in a celestial waltz around a black hole, captivated by the gravitational dance of the cosmic maestro.",333.png
"White hole brilliance, a cosmic burst of energy and light, a celestial spectacle defying the cosmic norms of energy expulsion.",334.png
"Wormhole mysteries, cosmic portals defying space-time conventions, harboring enigmatic cosmic secrets within their interstellar corridors.",335.png
"Parallel universe intersections, cosmic crossroads where alternate realities intersect, creating cosmic landscapes of intertwined destinies.",336.png
"Black hole horizon, the cosmic boundary where light succumbs to the gravitational forces of a black hole, disappearing into the cosmic abyss.",337.png
"White hole phenomena, a celestial burst of phenomena emanating from a white hole, casting cosmic wonders into the vast cosmic expanse.",338.png
"Wormhole explorers, celestial voyagers navigating the cosmic highways of wormholes, seeking cosmic frontiers beyond the known realms.",339.png
"Parallel universe echoes, cosmic reflections resonating through the fabric of space-time, whispering tales of alternate cosmic realities.",340.png
"Alien life enclaves, cosmic communities on distant planets flourishing in the cosmic embrace of their stellar surroundings.",341.png
"Black hole whispers, a cosmic symphony echoing through the cosmic void, reaching the ears of alien life forms across the celestial expanse.",342.png
"White hole sanctuaries, celestial realms of safety for alien life, where the cosmic energy radiates in harmony with their cosmic existence.",343.png
"Wormhole encounters, cosmic travelers from alien worlds exploring the vastness of space through the enigmatic corridors of the wormhole.",344.png
"Parallel universe alliances, cosmic coalitions formed by alien civilizations spanning the cosmic boundaries of alternate realities.",345.png
"Alien life mysteries, celestial enigmas dwelling on distant planets, their cosmic presence hidden amidst the cosmic expanse.",346.png
"Black hole observers, extraterrestrial beings witnessing the cosmic spectacle of stars swirling around a black hole, marveling at the cosmic dance.",347.png
"White hole emissaries, cosmic messengers from alien realms emerging from a white hole, bearing cosmic tidings to the cosmic explorers.",348.png
"Wormhole navigators, alien astronauts charting courses through the cosmic highways, propelled by the gravitational forces of wormholes.",349.png
"Parallel universe emissaries, cosmic diplomats traversing the celestial boundaries, fostering relations with alien civilizations in alternate realities.",350.png
"Alien life tapestry, a celestial quilt woven with threads of diverse extraterrestrial species, creating a cosmic mosaic of life beyond Earth.",351.png
"Black hole civilizations, advanced alien societies thriving near black holes, harnessing cosmic energy for their technological advancements.",352.png
"White hole beacons, cosmic lighthouses guiding alien spacefarers through the cosmic ocean of space, illuminating their celestial pathways.",353.png
"Wormhole envoys, representatives from alien worlds traversing the cosmic conduits, seeking interstellar connections with cosmic neighbors.",354.png
"Parallel universe alliances, cosmic coalitions formed by alien civilizations spanning the cosmic boundaries of alternate realities.",355.png
"Alien life enclaves, cosmic communities on distant planets flourishing in the cosmic embrace of their stellar surroundings.",356.png
"Black hole whispers, a cosmic symphony echoing through the cosmic void, reaching the ears of alien life forms across the celestial expanse.",357.png
"White hole sanctuaries, celestial realms of safety for alien life, where the cosmic energy radiates in harmony with their cosmic existence.",358.png
"Wormhole encounters, cosmic travelers from alien worlds exploring the vastness of space through the enigmatic corridors of the wormhole.",359.png
"Parallel universe alliances, cosmic coalitions formed by alien civilizations spanning the cosmic boundaries of alternate realities.",360.png
"Alien life mysteries, celestial enigmas dwelling on distant planets, their cosmic presence hidden amidst the cosmic expanse.",361.png
"Black hole observers, extraterrestrial beings witnessing the cosmic spectacle of stars swirling around a black hole, marveling at the cosmic dance.",362.png
"White hole emissaries, cosmic messengers from alien realms emerging from a white hole, bearing cosmic tidings to the cosmic explorers.",363.png
"Wormhole navigators, alien astronauts charting courses through the cosmic highways, propelled by the gravitational forces of wormholes.",364.png
"Parallel universe emissaries, cosmic diplomats traversing the celestial boundaries, fostering relations with alien civilizations in alternate realities.",365.png
"Alien life tapestry, a celestial quilt woven with threads of diverse extraterrestrial species, creating a cosmic mosaic of life beyond Earth.",366.png
"Black hole civilizations, advanced alien societies thriving near black holes, harnessing cosmic energy for their technological advancements.",367.png
"White hole beacons, cosmic lighthouses guiding alien spacefarers through the cosmic ocean of space, illuminating their celestial pathways.",368.png
"Wormhole envoys, representatives from alien worlds traversing the cosmic conduits, seeking interstellar connections with cosmic neighbors.",369.png
"Parallel universe ambassadors, envoys from extraterrestrial civilizations journeying through cosmic gateways to establish diplomatic ties.",370.png
"Alien life sanctuaries, celestial oases on distant planets where life flourishes, protected by the cosmic harmony of their cosmic surroundings.",371.png
"Black hole sentinels, extraterrestrial guardians stationed near black holes, maintaining cosmic order and balance in their cosmic domains.",372.png
"White hole nexuses, gathering points for alien civilizations, where cosmic energies converge, creating cosmic hubs of interstellar activity.",373.png
"Wormhole pioneers, alien explorers venturing into uncharted cosmic territories through the enigmatic passages of wormholes.",374.png
"Parallel universe harmonies, celestial melodies resonating through alternate realities, where alien species coexist in the cosmic symphony.",375.png
"Alien life labyrinths, intricate ecosystems on distant planets, navigating the cosmic complexity of their celestial environments.",376.png
"Black hole citadels, cosmic fortresses constructed by advanced alien civilizations near black holes, harnessing their cosmic power.",377.png
"White hole zeniths, celestial zeniths where advanced alien societies thrive, basking in the cosmic radiance of white hole energy.",378.png
"Wormhole wayfarers, alien nomads traversing the cosmic highways, exploring the vastness of space through the enigmatic corridors of wormholes.",379.png
"Parallel universe unions, cosmic alliances formed by extraterrestrial beings across alternate realities, fostering cosmic unity.",380.png
"Alien life enclaves, cosmic communities on distant planets flourishing in the cosmic embrace of their stellar surroundings.",381.png
"Black hole whispers, a cosmic symphony echoing through the cosmic void, reaching the ears of alien life forms across the celestial expanse.",382.png
"White hole sanctuaries, celestial realms of safety for alien life, where the cosmic energy radiates in harmony with their cosmic existence.",383.png
"Wormhole encounters, cosmic travelers from alien worlds exploring the vastness of space through the enigmatic corridors of the wormhole.",384.png
"Parallel universe alliances, cosmic coalitions formed by alien civilizations spanning the cosmic boundaries of alternate realities.",385.png
"Alien life mysteries, celestial enigmas dwelling on distant planets, their cosmic presence hidden amidst the cosmic expanse.",386.png
"Black hole observers, extraterrestrial beings witnessing the cosmic spectacle of stars swirling around a black hole, marveling at the cosmic dance.",387.png
"White hole emissaries, cosmic messengers from alien realms emerging from a white hole, bearing cosmic tidings to the cosmic explorers.",388.png
"Wormhole navigators, alien astronauts charting courses through the cosmic highways, propelled by the gravitational forces of wormholes.",389.png
"Parallel universe emissaries, cosmic diplomats traversing the celestial boundaries, fostering relations with alien civilizations in alternate realities.",390.png
"Alien life tapestry, a celestial quilt woven with threads of diverse extraterrestrial species, creating a cosmic mosaic of life beyond Earth.",391.png
"Black hole civilizations, advanced alien societies thriving near black holes, harnessing cosmic energy for their technological advancements.",392.png
"White hole beacons, cosmic lighthouses guiding alien spacefarers through the cosmic ocean of space, illuminating their celestial pathways.",393.png
"Wormhole envoys, representatives from alien worlds traversing the cosmic conduits, seeking interstellar connections with cosmic neighbors.",394.png
"Parallel universe ambassadors, envoys from extraterrestrial civilizations journeying through cosmic gateways to establish diplomatic ties.",395.png
"Alien life sanctuaries, celestial oases on distant planets where life flourishes, protected by the cosmic harmony of their cosmic surroundings.",396.png
"Black hole sentinels, extraterrestrial guardians stationed near black holes, maintaining cosmic order and balance in their cosmic domains.",397.png
"White hole nexuses, gathering points for alien civilizations, where cosmic energies converge, creating cosmic hubs of interstellar activity.",398.png
"Wormhole pioneers, alien explorers venturing into uncharted cosmic territories through the enigmatic passages of wormholes.",399.png
"Parallel universe harmonies, celestial melodies resonating through alternate realities, where alien species coexist in the cosmic symphony.",400.png
"Galactic collision ballet, a mesmerizing dance as two galaxies gracefully collide, creating celestial ripples in the cosmic fabric.",401.png
"Planetary convergence, a cosmic event where distant worlds align in a celestial dance, creating intricate cosmic patterns in the night sky.",402.png
"Cluster collision echoes, remnants of a cosmic clash between galactic clusters, leaving behind cosmic signatures in the vastness of space.",403.png
"Predicted cosmic rendezvous, astronomers anticipate the collision of two celestial bodies, visualized in the cosmic forecast of impending events.",404.png
"Galactic merger symphony, the harmonious collision of galaxies, composing a cosmic masterpiece of intertwined celestial bodies.",405.png
"Planetary collision aftermath, cosmic debris from the collision of planets forming a celestial tapestry of destruction and creation.",406.png
"Cluster collision choreography, celestial bodies in galactic clusters choreographing a cosmic dance, influenced by gravitational forces.",407.png
"Predicted cosmic encounter, astronomers foresee the collision of cosmic entities, predicting the visual spectacle in the cosmic timeline.",408.png
"Galactic ballet of destruction, a collision between galaxies unleashing cosmic energies, sculpting the celestial landscape with celestial chaos.",409.png
"Planetary cataclysm, a cosmic event where planets collide, reshaping the cosmic terrain and leaving behind traces of celestial impact.",410.png
"Cluster collision remnants, cosmic echoes from the collision of galactic clusters, painting the cosmic canvas with celestial remnants.",411.png
"Predicted celestial fireworks, astronomers anticipate a cosmic event where celestial bodies collide, envisioning a display of cosmic pyrotechnics.",412.png
"Galactic fusion aftermath, remnants of a cosmic fusion between galaxies, creating a celestial aftermath of combined cosmic energies.",413.png
"Planetary collision aftermath, cosmic debris from the collision of planets forming a celestial tapestry of destruction and creation.",414.png
"Cluster collision choreography, celestial bodies in galactic clusters choreographing a cosmic dance, influenced by gravitational forces.",415.png
"Predicted cosmic encounter, astronomers foresee the collision of cosmic entities, predicting the visual spectacle in the cosmic timeline.",416.png
"Galactic ballet of destruction, a collision between galaxies unleashing cosmic energies, sculpting the celestial landscape with celestial chaos.",417.png
"Planetary cataclysm, a cosmic event where planets collide, reshaping the cosmic terrain and leaving behind traces of celestial impact.",418.png
