description,image_id
"A majestic spiral galaxy filled with billions of stars.",1.png
"The ethereal beauty of a nebula, a stellar nursery where stars are born.",2.png
"An astronaut floating weightlessly in the vastness of space.",3.png
"The glowing trails of a meteor shower painting the night sky.",4.png
"A close-up view of the moon's rugged surface, marked by craters and valleys.",5.png
"The mesmerizing dance of the Northern Lights in the polar skies.",6.png
"The intense brightness of a supernova, the explosive death of a massive star.",7.png
"Saturn's iconic rings, a stunning example of the beauty of the solar system.",8.png
"A comet streaking through space, leaving a trail of cosmic dust.",9.png
"A futuristic space station orbiting Earth, a hub for scientific exploration.",10.png
"A distant exoplanet with a colorful atmosphere, potentially harboring life.",11.png
"The breathtaking panorama of a Martian sunset over the red landscape.",12.png
"The Orion Nebula, a celestial masterpiece of gas and dust.",13.png
"The rhythmic pulse of a pulsar, a rapidly rotating neutron star.",14.png
"The Hubble Space Telescope capturing distant galaxies in unprecedented detail.",15.png
"A black hole, an invisible force with gravity so strong that nothing escapes.",16.png
"The Milky Way, our home galaxy, stretching across the night sky.",17.png
"A space probe exploring the icy moons of Jupiter for signs of life.",18.png
"The Andromeda Galaxy, destined to collide with the Milky Way in the distant future.",19.png
"A space shuttle launching into orbit, carrying astronauts to new frontiers.",20.png
"The interstellar medium, a vast expanse of gas and dust between stars.",21.png
"Earth as seen from the International Space Station, a fragile blue oasis.",22.png
"The surreal beauty of a quasar, a supermassive black hole powering a distant galaxy.",23.png
"A cosmic ray shower illuminating the Earth's atmosphere with high-energy particles.",24.png
"The Great Red Spot on Jupiter, a massive storm that has raged for centuries.",25.png
"The Oort Cloud, a distant reservoir of icy bodies at the edge of the solar system.",26.png
"A lunar eclipse, casting a reddish hue on the moon during Earth's shadow.",27.png
"The eerie silence of space, where sound cannot travel in the vacuum.",28.png
"The spectacular rings of Uranus, tilted on their side compared to other planets.",29.png
"A space telescope observing the birth of new stars in a stellar nursery.",30.png
"The concept of dark matter, an elusive substance shaping the cosmos.",31.png
"A satellite orbiting a distant exoplanet, studying its atmosphere from afar.",32.png
"The beauty of gravitational lensing, where massive objects bend and distort light.",33.png
"A cosmic ray burst, a mysterious and powerful explosion in deep space.",34.png
"The Pillars of Creation, towering columns of gas and dust in the Eagle Nebula.",35.png
"The heliosphere, a protective bubble created by the solar wind around our solar system.",36.png
"A binary star system, where two stars orbit around their common center of mass.",37.png
"The eerie glow of the zodiacal light, caused by sunlight scattering off dust in the solar system.",38.png
"The concept of wormholes, hypothetical shortcuts through spacetime.",39.png
"The breathtaking landscapes of Titan, Saturn's largest moon, with lakes of liquid methane.",40.png
"A cosmic microwave background, the faint glow left over from the Big Bang.",41.png
"The Kuiper Belt, a region of icy bodies beyond Neptune, including Pluto.",42.png
"The chaotic beauty of a turbulent star-forming region in the Carina Nebula.",43.png
"The concept of time dilation near a massive object, a prediction of Einstein's theory of relativity.",44.png
"A rover exploring the surface of Mars, searching for signs of past or present life.",45.png
"The eerie silence and vastness of the intergalactic voids between galaxy clusters.",46.png
"The violent beauty of a gamma-ray burst, one of the most energetic events in the universe.",47.png
"A space probe investigating a distant asteroid, unlocking secrets of the early solar system.",48.png
"The concept of a multiverse, where our universe is just one of many parallel realities.",49.png
"The eerie glow of the solar corona during a total solar eclipse.",50.png
"The cosmic web, a vast network of interconnected filaments of dark matter.",51.png
"A space elevator, a theoretical structure that could transport payloads from Earth to space.",52.png
"The beauty of an aurora on a gas giant, like Jupiter or Saturn.",53.png
"The concept of terraforming, transforming a celestial body to make it habitable for humans.",54.png
"The stunning beauty of the Whirlpool Galaxy, a classic spiral galaxy.",55.png
"The concept of a white hole, a hypothetical region of spacetime where nothing can enter.",56.png
"A pulsating variable star, changing in brightness over time.",57.png
"The eerie glow of the cosmic microwave background, echoing the birth of the universe.",58.png
"The concept of a Dyson sphere, a hypothetical megastructure surrounding a star to capture its energy.",59.png
"A space telescope capturing the birth of a new star in a molecular cloud.",60.png
"The concept of panspermia, the idea that life could be distributed throughout the universe by cosmic debris.",61.png
"The breathtaking beauty of a total lunar eclipse, with the moon bathed in a reddish glow.",62.png
"The concept of a cosmic string, a theoretical thread-like structure that could span the entire universe.",63.png
"The mysterious dark energy driving the accelerated expansion of the universe.",64.png
"A spaceship traveling at relativistic speeds, experiencing time dilation on a cosmic journey.",65.png
"The concept of a black hole firewall, a theoretical intense wall of energy at a black hole's event horizon.",66.png
"A quasar, a powerful and distant source of light powered by a supermassive black hole.",67.png
"The concept of panspermia, the idea that life could be distributed throughout the universe by cosmic debris.",68.png
"The breathtaking beauty of a total lunar eclipse, with the moon bathed in a reddish glow.",69.png
"The concept of a cosmic string, a theoretical thread-like structure that could span the entire universe.",70.png
"The mysterious dark energy driving the accelerated expansion of the universe.",71.png
"A spaceship traveling at relativistic speeds, experiencing time dilation on a cosmic journey.",72.png
"The concept of a black hole firewall, a theoretical intense wall of energy at a black hole's event horizon.",73.png
"A quasar, a powerful and distant source of light powered by a supermassive black hole.",74.png
"The concept of panspermia, the idea that life could be distributed throughout the universe by cosmic debris.",75.png
"The breathtaking beauty of a total lunar eclipse, with the moon bathed in a reddish glow.",76.png
"The concept of a cosmic string, a theoretical thread-like structure that could span the entire universe.",77.png
"The mysterious dark energy driving the accelerated expansion of the universe.",78.png
"A spaceship traveling at relativistic speeds, experiencing time dilation on a cosmic journey.",79.png
"The concept of a black hole firewall, a theoretical intense wall of energy at a black hole's event horizon.",80.png
"A quasar, a powerful and distant source of light powered by a supermassive black hole.",81.png
"The concept of panspermia, the idea that life could be distributed throughout the universe by cosmic debris.",82.png
"The breathtaking beauty of a total lunar eclipse, with the moon bathed in a reddish glow.",83.png
"The concept of a cosmic string, a theoretical thread-like structure that could span the entire universe.",84.png
"The mysterious dark energy driving the accelerated expansion of the universe.",85.png
"A spaceship traveling at relativistic speeds, experiencing time dilation on a cosmic journey.",86.png
"The concept of a black hole firewall, a theoretical intense wall of energy at a black hole's event horizon.",87.png
"A quasar, a powerful and distant source of light powered by a supermassive black hole.",88.png
"The concept of panspermia, the idea that life could be distributed throughout the universe by cosmic debris.",89.png
"The breathtaking beauty of a total lunar eclipse, with the moon bathed in a reddish glow.",90.png
"The concept of a cosmic string, a theoretical thread-like structure that could span the entire universe.",91.png
"The mysterious dark energy driving the accelerated expansion of the universe.",92.png
"A spaceship traveling at relativistic speeds, experiencing time dilation on a cosmic journey.",93.png
"The concept of a black hole firewall, a theoretical intense wall of energy at a black hole's event horizon.",94.png
"A quasar, a powerful and distant source of light powered by a supermassive black hole.",95.png
"The concept of panspermia, the idea that life could be distributed throughout the universe by cosmic debris.",96.png
"The breathtaking beauty of a total lunar eclipse, with the moon bathed in a reddish glow.",97.png
"The concept of a cosmic string, a theoretical thread-like structure that could span the entire universe.",98.png
"The mysterious dark energy driving the accelerated expansion of the universe.",99.png
"A spaceship traveling at relativistic speeds, experiencing time dilation on a cosmic journey.",100.png
"A binary star system dancing in an eternal gravitational embrace.",101.png
"Nebulous clouds swirling in the vastness, birthing new stars in their cosmic cradle.",102.png
"Planets, like marbles in a celestial game, orbiting their radiant parent star.",103.png
"A pulsar's rhythmic dance, sending beams of light across the cosmic expanse.",104.png
"Galaxies colliding, a celestial ballet of stars and dust spanning eons.",105.png
"Black holes, voracious giants, devouring light and distorting spacetime.",106.png
"Supernovae, cosmic explosions painting the darkness with fiery brilliance.",107.png
"Interstellar dust, the building blocks of new worlds, drifting in the void.",108.png
"Quasars, cosmic lighthouses illuminating the darkest corners of the universe.",109.png
"Cosmic filaments, threads of galaxies weaving through the cosmic tapestry.",110.png
"Gamma-ray bursts, fleeting flashes of the universe's most energetic events.",111.png
"Exoplanets, distant worlds waiting to be explored, orbiting alien suns.",112.png
"Cosmic voids, vast expanses where galaxies are sparse and darkness reigns.",113.png
"Solar flares, eruptions of solar plasma dancing on the surface of a star.",114.png
"Dark matter, the invisible scaffolding upon which galaxies are built.",115.png
"Cosmic rays, messengers from the depths of space, racing across the universe.",116.png
"Red giants, aging stars casting off their outer layers in a cosmic sigh.",117.png
"White dwarfs, stellar remnants cooling slowly in the cosmic chill.",118.png
"The cosmic microwave background, a relic of the universe's fiery birth.",119.png
"Interstellar gas clouds, nurseries where stars are born amidst the cosmic mist.",120.png
"Neutron stars, city-sized remnants of stellar explosions, spinning with unimaginable speed.",121.png
"Gravitational waves, ripples in spacetime echoing the universe's most violent events.",122.png
"Oort clouds, vast reservoirs of icy bodies at the edge of the solar system.",123.png
"Cosmic inflation, the explosive expansion that birthed the universe in its infancy.",124.png
"Magnetars, cosmic magnets with magnetic fields trillions of times stronger than Earth's.",125.png
"Stellar nurseries, regions where gas and dust coalesce, giving birth to stars.",126.png
"Asteroid belts, rocky remnants of planetary formation, orbiting their parent star.",127.png
"Extragalactic jets, streams of particles ejected from the hearts of active galaxies.",128.png
"Kuiper belt objects, icy relics from the early solar system, orbiting beyond Neptune.",129.png
"Supermassive black holes, lurking at the centers of galaxies, swallowing stars whole.",130.png
"Rogue planets, cosmic wanderers adrift in the darkness between the stars.",131.png
"Cosmic strings, hypothetical threads stretching across the universe, remnants of the Big Bang.",132.png
"Plasma storms, cosmic tempests raging on the surface of magnetized stars.",133.png
"Hypervelocity stars, cosmic cannonballs hurtling through the galaxy at breakneck speeds.",134.png
"Hawking radiation, the faint glow of black holes slowly evaporating into nothingness.",135.png
"Magnetospheres, protective shields surrounding planets, deflecting cosmic radiation.",136.png
"Galactic halos, vast regions of dark matter enveloping galaxies in their gravitational embrace.",137.png
"Cosmological constants, the fundamental parameters shaping the fabric of the universe.",138.png
"Tidal forces, cosmic tugs-of-war between celestial bodies, shaping their orbits.",139.png
"Extragalactic supernovae, titanic explosions visible across millions of light-years.",140.png
"Cosmic strings, theoretical threads weaving through the fabric of spacetime.",141.png
"Interstellar mediums, the cosmic seas of gas and dust that fill the space between stars.",142.png
"Magnetospheric storms, cosmic disturbances wreaking havoc on planetary atmospheres.",143.png
"Galactic collisions, cosmic cataclysms reshaping the structure of the universe.",144.png
"Stellar mergers, cosmic collisions forging new stars in a crucible of fire.",145.png
"The cosmic microwave background, a faint glow permeating the depths of space.",146.png
"Quasar jets, cosmic fountains of energy erupting from the hearts of active galaxies.",147.png
"Magnetohydrodynamic turbulence, cosmic chaos churning within the hearts of stars.",148.png
"Stellar novae, cosmic explosions lighting up the night sky with newfound brilliance.",149.png
"Planetary atmospheres, cosmic blankets wrapping worlds in warmth and protection.",150.png
"Gravitational lensing, the cosmic bending of light around massive objects.",151.png
"The galactic bar, a luminous structure cutting across the heart of spiral galaxies.",152.png
"Cosmic strings, hypothetical threads weaving through the fabric of the cosmos.",153.png
"Protostars, cosmic embryos shrouded in cocoons of gas and dust, awaiting birth.",154.png
"Gamma-ray bursts, the universe's most powerful explosions, visible across billions of light-years.",155.png
"Cosmic inflation, the rapid expansion that propelled the universe from a singularity.",156.png
"Magnetospheric auroras, cosmic light shows dancing at the poles of magnetized planets.",157.png
"Stellar nurseries, cradles of star formation nestled within the galactic arms.",158.png
"The galactic bulge, a dense hub of stars at the heart of the Milky Way.",159.png
"Planetary rings, cosmic jewelry encircling gas giants in delicate arcs.",160.png
"Galactic filaments, tendrils of galaxies stretching across the cosmic void.",161.png
"Accretion disks, swirling maelstroms of gas and dust feeding hungry black holes.",162.png
"Cosmic inflation, the explosive growth spurt that marked the universe's infancy.",163.png
"Magnetic reconnection events, cosmic fireworks igniting in the magnetic fields of stars.",164.png
"Stellar feedback, the energetic outbursts shaping the evolution of galaxies.",165.png
"The galactic halo, a vast reservoir of dark matter surrounding the Milky Way.",166.png
"Gravitational waves, ripples in spacetime echoing the universe's most violent events.",167.png
"Magnetohydrodynamic waves, cosmic tsunamis rippling through the plasma of stars.",168.png
"Stellar clusters, cosmic communities of stars bound together by gravity's embrace.",169.png
"Superluminous supernovae, cosmic explosions outshining entire galaxies for a fleeting moment.",170.png
"Cosmic microwave background radiation, the echo of the Big Bang reverberating through space.",171.png
"Protostellar jets, cosmic geysers blasting from the poles of newborn stars.",172.png
"Galactic cannibalism, larger galaxies devouring their smaller neighbors in the cosmic buffet.",173.png
"Stellar mergers, cosmic collisions forging new stars in a crucible of fire.",174.png
"The cosmic microwave background, a faint glow permeating the depths of space.",175.png
"Quasar jets, cosmic fountains of energy erupting from the hearts of active galaxies.",176.png
"Magnetohydrodynamic turbulence, cosmic chaos churning within the hearts of stars.",177.png
"Stellar novae, cosmic explosions lighting up the night sky with newfound brilliance.",178.png
"Planetary atmospheres, cosmic blankets wrapping worlds in warmth and protection.",179.png
"Gravitational lensing, the cosmic bending of light around massive objects.",180.png
"A nebula of vibrant hues, where newborn stars emerge from the cosmic clouds, painting the void with celestial brilliance.",181.png
"An intergalactic ballet of pulsars, their rhythmic dance echoing across the cosmic expanse, a mesmerizing symphony of cosmic timekeepers.",182.png
"A quasar-powered spacecraft hurtling through the cosmic tapestry, its warp drive bending space-time itself in pursuit of distant galaxies.",183.png
"The event horizon of a supermassive black hole, a cosmic boundary where gravity becomes an inescapable force, distorting the fabric of reality.",184.png
"A cosmic ocean of dark matter, its unseen currents shaping the cosmic web that connects galaxies in an intricate lattice.",185.png
"Exoplanets adorned with ethereal auroras, their atmospheres alive with the dance of charged particles under the influence of distant suns.",186.png
"A cosmic cathedral of cosmic dust, where stellar winds sculpt breathtaking structures that defy imagination in the cold vacuum of space.",187.png
"A rogue planet wandering through the cosmic wilderness, a solitary traveler untouched by the gravitational embrace of any star.",188.png
"A cosmic nursery where protostars cradle the promise of new solar systems, surrounded by the swirling remnants of their molecular birth clouds.",189.png
"A cosmic quasar beacon, its intense luminosity piercing the darkness, guiding explorers through the vastness of the intergalactic sea.",190.png
"A wormhole gateway, a cosmic shortcut that transcends the conventional boundaries of space, linking distant corners of the universe.",191.png
"A cosmic storm of charged particles, creating dazzling cosmic lightning displays that illuminate the cosmic canvas in electrifying hues.",192.png
"Galactic collisions, a cosmic ballet where titanic forces reshape galaxies, merging and transforming their structures in a celestial dance.",193.png
"A cosmic archive, a repository of ancient light that carries the whispers of galaxies long gone, revealing the secrets of cosmic history.",194.png
"An antimatter nebula, a cosmic realm where particles and antiparticles coexist in a delicate balance, threatening to annihilate upon contact.",195.png
"A cosmic lighthouse pulsating in the darkness, a magnetar's intense beams cutting through the cosmic fog, guiding celestial wayfarers.",196.png
"Exoplanetary rings, a cosmic jewelry adorning distant worlds with shimmering bands of ice and rock, caught in the gravitational embrace of their host.",197.png
"A cosmic mirror, a black hole's accretion disk reflecting the warped space-time around it, distorting the cosmic reflections within.",198.png
"Quantum fluctuations in the cosmic microwave background, tiny ripples in the fabric of the early universe imprinted on the cosmic afterglow.",199.png
"A cosmic garden of galactic blooms, where vibrant galaxies blossom like celestial flowers in the fertile fields of dark matter.",200.png
"A cosmic crystal lattice, where the geometry of space-time itself takes on a crystalline structure, revealing the cosmic order beneath the chaos.",201.png
"The cosmic chorus of gravitational waves, ripples in space-time echoing the cosmic events that resonate through the vast cosmic amphitheater.",202.png
"A cosmic library of exoplanetary atmospheres, each volume containing the unique compositions and tales of distant worlds beyond our cosmic neighborhood.",203.png
"A quasar's accretion disk, a swirling maelstrom of cosmic matter spiraling into the gravitational abyss, fueling the radiant heart of an active galactic nucleus.",204.png
"Cosmic comets streaking through the void, their icy tails painting ephemeral strokes on the cosmic canvas as they journey through the interstellar darkness.",205.png
"A cosmic phoenix, a dying star's explosive rebirth as a supernova, scattering its enriched cosmic ashes across the intergalactic landscape.",206.png
"Dark energy's cosmic repulsion, an invisible force driving the accelerated expansion of the cosmic frontier, pushing galaxies farther apart in the cosmic dance.",207.png
"A cosmic time capsule, a relic from the early universe preserving the cosmic fingerprint of primordial elements forged in the cosmic crucible.",208.png
"The cosmic dance of binary stars, celestial partners locked in an eternal embrace, pirouetting around their common center of gravity.",209.png
"A cosmic corkscrew, the spiraling jets of a supermassive black hole carving through the cosmic medium, leaving a luminous trail in their wake.",210.png
"Quantum entanglement on a cosmic scale, particles separated by cosmic distances remaining mysteriously connected, their fates intertwined across the cosmic stage.",211.png
"A cosmic bazaar of galactic collisions, where the market of cosmic mergers exchanges stars, gas, and dust in a grand celestial commerce.",212.png
"A cosmic cathedral of cosmic rays, high-energy particles from distant reaches of the universe illuminating the cosmic sanctum with their ethereal glow.",213.png
"Galactic archaeology, a cosmic excavation of ancient stars and their relics, revealing the cosmic history etched in the stellar ruins.",214.png
"A cosmic sentinel, a massive exoplanet standing guard at the outer reaches of its solar system, shielding its inner celestial companions from cosmic intruders.",215.png
"Cosmic illusions, a gravitational mirage distorting the panorama with illusions of distant galaxies and warping the fabric of space-time.",216.png
"Celestial sculptors, nebulous pillars of creation carving colossal formations of interstellar gas and dust, birthing new stars in their cosmic embrace.",217.png
"Gravitational precipice, where a star's pull reaches its limit, light bending as it teeters on the edge of a black hole's event horizon.",218.png
"Exoplanetary oddities, a celestial menagerie showcasing cosmic wonders, from diamond rain to seas of molten metal, under the scrutiny of distant suns.",219.png
"Quantum froth, cosmic shoreline where space-time's smallest scales froth and bubble, revealing the inherent uncertainty woven into the cosmic fabric.",220.png
"Time capsule of the cosmos, an ancient globular cluster preserving stars as old as the universe itself, harboring cosmic history within its stellar archives.",221.png
"Cosmic heartbeat, pulsating variable stars rhythmically shining and dimming, marking time in the cosmic chronicle with their celestial cadence.",222.png
"Gravitational slingshot, where a spacecraft rides the cosmic ballet of planetary orbits, gaining momentum deeper into the cosmic vastness.",223.png
"Cosmic renaissance, burst of star formation painting a galaxy's canvas with brilliant hues as nebulae birth new generations of stellar brilliance.",224.png
"Hyperspace tunnels, cosmic shortcuts connecting disparate regions of the universe, bypassing the conventional constraints of space-time in the cosmic expressway.",225.png
"Cosmic clockwork, finely tuned arrangement of planetary orbits and cosmic cycles orchestrating the dance of celestial bodies in the grand cosmic performance.",226.png
"Cosmic archipelago, galaxies floating like islands in the vast cosmic ocean, connected by gravitational currents shaping their cosmic destiny.",227.png
"Alchemist's laboratory of the cosmos, where fusion furnaces of stars transmute cosmic elements, forging heavier elements that enrich the cosmic landscape.",228.png
"Quantum entanglement bridges, invisible threads connecting cosmic particles across immense distances, maintaining a cosmic communion beyond the constraints of space.",229.png
"Cosmic whisperer, a neutron star emitting faint signals carrying cosmic secrets, decipherable only by those attuned to the subtle language of the cosmos.",230.png
"Dance of auroras in the cosmos, where charged particles paint luminous curtains of light across the magnetic fields of distant planets.",231.png
"Cosmic magnetic storm, where invisible threads of magnetic fields intertwine, unleashing cosmic tempests that sculpt the plasma landscapes of the universe.",232.png
"Cosmic kaleidoscope, where gravitational lensing transforms distant galaxies into intricate patterns, revealing cosmic artistry hidden in the depths.",233.png
"Baryon harvester of the cosmos, a black hole feasting on intergalactic gas, growing in size as it devours the cosmic harvest of matter from its surroundings.",234.png
"Cosmic forge, a massive star reaching the end of its life, fusing heavier elements in its fiery core before releasing them into the cosmic crucible.",235.png
"Carnival of colors in the cosmos, as gas giants' atmospheres reflect the light of distant suns, creating vibrant and ever-changing celestial spectacles.",236.png
"Siren's song in the cosmos, the haunting melody of gravitational waves emanating from the cosmic mergers of massive objects, resonating through the cosmic symphony.",237.png
"Cosmic desert, vast regions of intergalactic space devoid of significant cosmic structures, where the cosmic vacuum reigns supreme.",238.png
"Interstellar celestial nursery, where protoplanetary disks orbit young stars, laying the foundation for the birth of planets in the cosmic cradle.",239.png
"Cosmic balance beam, binary stars in delicate equilibrium, their cosmic dance finely tuned to maintain stability in their celestial partnership.",240.png
